[
  {
    "schemaVersion": 1,
    "id": "starter-kit",
    "name": "TinyLaps Workshop",
    "description": "Two working examples of maps, custom racers and physical scenery made from a content pack.",
    "cars": [
      {
        "id": "copper-coupe",
        "name": "Copper Coupe",
        "color": "#CB8659",
        "topSpeed": 21.7,
        "cornering": 11.9,
        "acceleration": 6.1,
        "mass": 740,
        "model": {
          "body": "coupe",
          "scale": [
            1.02,
            1,
            1.03
          ],
          "stripeColor": "#FFF1D4",
          "accentColor": "#4B635C"
        },
        "personality": {
          "label": "The explorer",
          "description": "Keeps a clean line and looks for room before passing.",
          "aggression": 0.72,
          "bravery": 0.85,
          "defensiveness": 0.65,
          "awareness": 0.96
        }
      },
      {
        "id": "meadow-pickup",
        "name": "Meadow Pickup",
        "color": "#87AF91",
        "topSpeed": 20.8,
        "cornering": 11.8,
        "acceleration": 5.9,
        "mass": 850,
        "model": {
          "body": "pickup",
          "scale": [
            1.04,
            1.03,
            1.06
          ],
          "stripeColor": "#EFE4CA",
          "accentColor": "#56675D"
        },
        "personality": {
          "label": "The steady hand",
          "description": "Leaves space, brakes early and builds speed on the exit.",
          "aggression": 0.65,
          "bravery": 0.78,
          "defensiveness": 0.7,
          "awareness": 0.98
        }
      }
    ],
    "props": [
      {
        "id": "workshop-pavilion",
        "name": "Workshop pavilion",
        "kind": "building",
        "collider": {
          "radius": 2.5,
          "mass": 1600,
          "height": 3.1
        },
        "parts": [
          {
            "shape": "box",
            "size": [
              3.6,
              0.3,
              2.8
            ],
            "position": [
              0,
              0.15,
              0
            ],
            "color": "#B9B8A6"
          },
          {
            "shape": "box",
            "size": [
              3.2,
              2.2,
              2.4
            ],
            "position": [
              0,
              1.4,
              0
            ],
            "color": "#F0E7D1"
          },
          {
            "shape": "box",
            "size": [
              3.7,
              0.4,
              2.9
            ],
            "position": [
              0,
              2.8,
              0
            ],
            "color": "#6C8876"
          },
          {
            "shape": "box",
            "size": [
              0.65,
              1.3,
              0.1
            ],
            "position": [
              0,
              0.95,
              1.26
            ],
            "color": "#AA785E"
          },
          {
            "shape": "box",
            "size": [
              0.65,
              0.7,
              0.08
            ],
            "position": [
              -0.95,
              1.6,
              1.25
            ],
            "color": "#6C9296"
          },
          {
            "shape": "box",
            "size": [
              0.65,
              0.7,
              0.08
            ],
            "position": [
              0.95,
              1.6,
              1.25
            ],
            "color": "#6C9296"
          }
        ]
      },
      {
        "id": "garden-marker",
        "name": "Garden marker",
        "kind": "rock",
        "collider": {
          "radius": 0.75,
          "mass": 160,
          "height": 1.2
        },
        "parts": [
          {
            "shape": "cylinder",
            "size": [
              0.52,
              0.35,
              0.6
            ],
            "position": [
              0,
              0.175,
              0
            ],
            "color": "#C8BDA4"
          },
          {
            "shape": "sphere",
            "size": [
              0.42,
              0.4,
              0.42
            ],
            "position": [
              0,
              0.75,
              0
            ],
            "color": "#87AF91"
          }
        ]
      }
    ],
    "maps": [
      {
        "id": "workshop-orchard",
        "name": "Workshop Orchard",
        "description": "A broad orchard circuit with a small pavilion, garden markers and two custom racer silhouettes.",
        "setting": "alpine",
        "difficulty": "Easy",
        "seed": 31415,
        "routeRevision": 1,
        "points": [
          [
            -39,
            0.17,
            26
          ],
          [
            0,
            0.17,
            29
          ],
          [
            38,
            0.17,
            26
          ],
          [
            44,
            0.17,
            12
          ],
          [
            43,
            0.17,
            -16
          ],
          [
            30,
            0.17,
            -29
          ],
          [
            0,
            0.17,
            -30
          ],
          [
            -32,
            0.17,
            -27
          ],
          [
            -44,
            0.17,
            -12
          ],
          [
            -44,
            0.17,
            13
          ]
        ],
        "cars": [
          "starter-kit/copper-coupe",
          "starter-kit/meadow-pickup",
          "builtin/cherry",
          "builtin/bluebell",
          "builtin/minty"
        ],
        "props": [
          {
            "id": "pavilion",
            "prop": "starter-kit/workshop-pavilion",
            "x": -10,
            "z": 0,
            "yaw": 0.18
          },
          {
            "id": "marker",
            "prop": "starter-kit/garden-marker",
            "x": 12,
            "z": -3
          }
        ]
      },
      {
        "id": "workshop-quarter",
        "name": "Workshop Quarter",
        "description": "A connected street grid with local traffic, parks and a race that turns through the neighborhoods.",
        "setting": "sunset",
        "difficulty": "City",
        "seed": 27182,
        "routeRevision": 1,
        "city": {
          "xs": [
            -40,
            -24,
            -8,
            8,
            24,
            40
          ],
          "zs": [
            -28,
            -14,
            0,
            14,
            28
          ],
          "width": 7,
          "warp": 0,
          "parks": [
            [
              1,
              1
            ],
            [
              3,
              2
            ]
          ],
          "style": "historic",
          "residents": 72,
          "traffic": 20,
          "seed": 27182
        },
        "cityRoute": [
          [
            0,
            1
          ],
          [
            4,
            1
          ],
          [
            4,
            0
          ],
          [
            5,
            0
          ],
          [
            5,
            4
          ],
          [
            3,
            4
          ],
          [
            3,
            2
          ],
          [
            2,
            2
          ],
          [
            2,
            4
          ],
          [
            0,
            4
          ],
          [
            0,
            3
          ],
          [
            1,
            3
          ],
          [
            1,
            2
          ],
          [
            0,
            2
          ]
        ],
        "cars": [
          "starter-kit/copper-coupe",
          "builtin/clementine",
          "starter-kit/meadow-pickup",
          "builtin/rosie",
          "builtin/inky"
        ],
        "props": [
          {
            "id": "park-marker",
            "prop": "starter-kit/garden-marker",
            "x": -16,
            "z": -7
          }
        ]
      }
    ]
  }
]
